{
  "$schema": "https://json-schema.org/draft/2020-12/schema",
  "$id": "timeline.schema.json",
  "title": "Timeline",
  "type": "object",
  "required": ["id", "type", "name", "order"],
  "additionalProperties": false,
  "properties": {
    "id": {"type": "string", "pattern": "^[a-z0-9]+(?:-[a-z0-9]+)*$"},
    "type": {"const": "timeline"},
    "name": {"type": "string", "minLength": 1},
    "description": {"type": "string"},
    "order": {"type": "integer", "minimum": 0},
    "eraLabel": {"type": "string"},
    "startsWith": {"type": ["string", "null"]},
    "endsWith": {"type": ["string", "null"]}
  }
}
